{
  "schema_version": "ts-decision/2",
  "decision_id": "${DECISION_ID}",
  "action": "start_node",
  "rationale": "Search for a transition-state candidate under the active hypothesis.",
  "evidence_refs": [],
  "base_revision": "${BASE_REVISION}",
  "report_ref": {"report_id": "${REPORT_ID}", "workspace_root": "${WORKSPACE_ROOT}"},
  "payload": {
    "node_id": "${NODE_ID}",
    "parent_node": "${PARENT_NODE}",
    "node_type": "candidate_search",
    "candidate_kind": "transition_state",
    "objective": "Generate a transition-state candidate for the declared mechanism.",
    "hypothesis_ref": {"hypothesis_id": "${HYPOTHESIS_ID}", "prediction_ids": []},
    "branch_context": {"relation": "continue_parent", "from_node": "${PARENT_NODE}", "anchor_node": "n000"},
    "expected_evidence": ["candidate_geometry"]
  }
}
