{
  "schema_version": "ts-decision/2",
  "decision_id": "${DECISION_ID}",
  "action": "end_node",
  "rationale": "Close the intake after input normalization.",
  "evidence_refs": ["${EVIDENCE_ID}"],
  "base_revision": "${BASE_REVISION}",
  "report_ref": {"report_id": "${REPORT_ID}", "workspace_root": "${WORKSPACE_ROOT}"},
  "payload": {
    "node_id": "n000",
    "closure": {
      "summary": "The research inputs are normalized.",
      "program": {"outcome": "not_run", "summary": "No external program was required.", "evidence_refs": ["${EVIDENCE_ID}"]},
      "intake": {"status": "ready"},
      "open_questions": []
    }
  }
}
