{
  "schema_version": "ts-decision/2",
  "decision_id": "${DECISION_ID}",
  "action": "start_node",
  "rationale": "Propose an explicit, falsifiable mechanism hypothesis.",
  "evidence_refs": ["${EVIDENCE_ID}"],
  "base_revision": "${BASE_REVISION}",
  "report_ref": {"report_id": "${REPORT_ID}", "workspace_root": "${WORKSPACE_ROOT}"},
  "payload": {
    "node_id": "${NODE_ID}",
    "parent_node": "n000",
    "node_type": "mechanism",
    "objective": "Propose a hypothesis derived from the normalized endpoints.",
    "mechanism_action": "propose",
    "proposed_hypothesis": {
      "hypothesis_id": "${HYPOTHESIS_ID}",
      "parent_hypothesis_id": null,
      "summary": "${HYPOTHESIS_SUMMARY}",
      "derived_from": {},
      "structured_claim": {},
      "mechanism_claims": [],
      "testable_predictions": [],
      "required_evidence": [],
      "uncertainties": [],
      "alternative_hypotheses": [],
      "evidence_refs": ["${EVIDENCE_ID}"]
    },
    "branch_context": {"relation": "continue_parent", "from_node": "n000", "anchor_node": "n000", "evidence_refs": ["${EVIDENCE_ID}"]}
  }
}
