{
  "schema_version": "ts-decision/2",
  "decision_id": "${DECISION_ID}",
  "action": "start_node",
  "rationale": "Normalize the supplied research inputs.",
  "evidence_refs": [],
  "base_revision": "${BASE_REVISION}",
  "report_ref": {"report_id": "${REPORT_ID}", "workspace_root": "${WORKSPACE_ROOT}"},
  "payload": {
    "node_id": "n000",
    "parent_node": null,
    "node_type": "intake",
    "objective": "Normalize structures, constraints, and completion criteria.",
    "expected_evidence": ["reaction_center_delta"]
  }
}
